{
  "scan_id": "scan-885",
  "timestamp": "2026-08-14T10:09:00Z",
  "risk_assessment": {
    "risk_score": 85,
    "risk_severity": "HIGH",
    "confidence": 0.9,
    "signals": ["KNOWN_PHISHING_DOMAIN", "FAKE_BRAND_IMPERSONATION"],
    "evidence_references": ["evid-10"],
    "human_explanation": "This referral link impersonates a known brand but redirects to a phishing site.",
    "recommended_action": "DO NOT OPEN"
  },
  "protection_decision": {
    "action": "DISCOURAGE_PROCEED",
    "detected_summary": "Fake Referral Link",
    "why_it_matters": "Opening this link may expose your personal information to scammers.",
    "user_instruction": "Delete the message and do not click the link."
  }
}
