{
  "scan_id": "scan-882",
  "timestamp": "2026-08-14T10:06:00Z",
  "risk_assessment": {
    "risk_score": 95,
    "risk_severity": "CRITICAL",
    "confidence": 0.99,
    "signals": ["KNOWN_SCAM_VPA", "HIGH_VALUE_REQUEST"],
    "evidence_references": ["evid-1"],
    "human_explanation": "This UPI ID is known for fraudulent activities.",
    "recommended_action": "DO NOT PAY"
  },
  "protection_decision": {
    "action": "DISCOURAGE_PROCEED",
    "detected_summary": "High Risk UPI ID Detected",
    "why_it_matters": "Transferring money to this account may lead to permanent loss.",
    "user_instruction": "Cancel this transaction immediately."
  },
  "evidence_pack": {
    "incident_id": "inc-882",
    "timestamp": "2026-08-14T10:06:00Z",
    "items": [
      {
        "evidence_id": "evid-1",
        "evidence_type": "UPI_IDENTIFIER",
        "data": "scammer@bank",
        "explanation": "Default explanation",
        "source_category": "OBSERVED_FACT"
      }
    ]
  }
}
