{
  "scan_id": "scan-883",
  "timestamp": "2026-08-14T10:07:00Z",
  "risk_assessment": {
    "risk_score": 5,
    "risk_severity": "LOW",
    "confidence": 0.9,
    "signals": [
      "VERIFIED_BRAND_DOMAIN"
    ],
    "evidence_references": [],
    "human_explanation": "This appears to be a legitimate referral link from a known brand.",
    "recommended_action": "SAFE_TO_OPEN"
  },
  "protection_decision": {
    "action": "ALLOW",
    "detected_summary": "Legitimate Link",
    "why_it_matters": "No risks detected.",
    "user_instruction": "You may proceed."
  }
}